{
  "schema_version": 1,
  "model_id": "zh-en-bilingual-zipformer-2023-02-20",
  "model_name": "sherpa-onnx-streaming-zipformer-bilingual-zh-en-2023-02-20",
  "model_version": "2023-02-20-int8",
  "model_family": "sherpa-onnx",
  "artifact_format": "onnx",
  "artifact_source_url": "https://huggingface.co/csukuangfj/sherpa-onnx-streaming-zipformer-bilingual-zh-en-2023-02-20/resolve/main/encoder-epoch-99-avg-1.int8.onnx",
  "license_url": "https://www.apache.org/licenses/LICENSE-2.0",
  "sha256": "8fa764187a261844f859d7143ebaa563af5d10adfece4c18a8f414c88cba2a9b",
  "artifact_size_mb": 172.6641,
  "package_evidence_path": "package-evidence.json",
  "runtime_ids": ["sherpa-onnx"],
  "runtime_conversion_status": "native",
  "runtime_conversion_evidence_path": "runtime-conversion-evidence.json",
  "runtime_conversion_notes": "Native sherpa-onnx streaming transducer (zipformer, bilingual ZH+EN) consumed directly via OnlineRecognizer transducer model field (encoder/decoder/joiner int8) on the v1.13.2 Android runtime. No format conversion required.",
  "legal_review_evidence_path": "legal-review-evidence.json",
  "intended_use": "asr",
  "distribution_mode": "first_run_download",
  "legal_review_status": "approved_for_distribution",
  "review_owner": "flex-translate",
  "review_date": "2026-06-01",
  "commercial_restrictions_reviewed": true,
  "privacy_impact_reviewed": true,
  "app_store_policy_reviewed": true,
  "notes": "ZH/EN bilingual A2 demo model. Streaming transducer int8. One model covers both ZH speaker and EN speaker dialogue flows. Downloaded to device, NOT bundled in APK. sha256/artifact_size_mb describe the encoder artifact; package-evidence.json enumerates all four files. A2 demo evidence is not a launch-support claim; support matrix still requires WS6 benchmark evidence."
}
