{
  "schema_version": 1,
  "model_id": "en-zipformer-mid-high-2023-06-26",
  "model_name": "sherpa-onnx-streaming-zipformer-en-2023-06-26",
  "model_version": "2023-06-26-int8-chunk-16-left-128",
  "model_family": "sherpa-onnx",
  "artifact_format": "onnx",
  "artifact_source_url": "https://huggingface.co/csukuangfj/sherpa-onnx-streaming-zipformer-en-2023-06-26/resolve/main/encoder-epoch-99-avg-1-chunk-16-left-128.int8.onnx",
  "license_url": "https://www.apache.org/licenses/LICENSE-2.0",
  "sha256": "563fde436d16cf7607cf408cd6b30909819d03162652ef389c2450ced3f45ac1",
  "artifact_size_mb": 67.7902,
  "package_evidence_path": "package-evidence.json",
  "runtime_ids": ["sherpa-onnx"],
  "runtime_conversion_status": "native",
  "runtime_conversion_evidence_path": "runtime-conversion-evidence.json",
  "runtime_conversion_notes": "Native sherpa-onnx streaming transducer (zipformer2) consumed directly via OnlineRecognizer transducer model field (encoder/decoder/joiner int8 chunk-16-left-128) on the v1.13.2 Android runtime. No format conversion required.",
  "legal_review_evidence_path": "legal-review-evidence.json",
  "intended_use": "asr",
  "distribution_mode": "first_run_download",
  "legal_review_status": "approved_for_distribution",
  "review_owner": "flex-translate",
  "review_date": "2026-06-01",
  "commercial_restrictions_reviewed": true,
  "privacy_impact_reviewed": true,
  "app_store_policy_reviewed": true,
  "notes": "EN A2 demo model. Streaming transducer, int8 chunk-16-left-128 variant (encoder.int8 + decoder.int8 + joiner.int8 + tokens.txt). Downloaded to device, NOT bundled in the APK. sha256/artifact_size_mb describe the representative encoder artifact; package-evidence.json enumerates all four files. A2 demo evidence is not a launch-support claim; support matrix still requires WS6 benchmark evidence."
}
