{
  "schema_version": 1,
  "model_id": "ru-t-one-streaming-2025-09-08",
  "model_name": "sherpa-onnx-streaming-t-one-russian-2025-09-08",
  "model_version": "2025-09-08",
  "model_family": "sherpa-onnx",
  "artifact_format": "onnx",
  "artifact_source_url": "https://huggingface.co/csukuangfj/sherpa-onnx-streaming-t-one-russian-2025-09-08/resolve/main/model.onnx",
  "license_url": "https://www.apache.org/licenses/LICENSE-2.0",
  "sha256": "5ded080e2a6c86ecc11bcb0902d77524eb3e8b0844cb0c0754347f5aafb4dabc",
  "artifact_size_mb": 137.5138,
  "package_evidence_path": "package-evidence.json",
  "runtime_ids": ["sherpa-onnx"],
  "runtime_conversion_status": "native",
  "runtime_conversion_evidence_path": "runtime-conversion-evidence.json",
  "runtime_conversion_notes": "Native sherpa-onnx streaming CTC (T-one Russian) ONNX artifact loaded directly by the OnlineRecognizer toneCtc model field on the v1.13.2 Android runtime (libsherpa-onnx-jni.so / libonnxruntime.so, arm64-v8a). No format conversion required.",
  "legal_review_evidence_path": "legal-review-evidence.json",
  "intended_use": "asr",
  "distribution_mode": "first_run_download",
  "legal_review_status": "approved_for_distribution",
  "review_owner": "flex-translate",
  "review_date": "2026-06-01",
  "commercial_restrictions_reviewed": true,
  "privacy_impact_reviewed": true,
  "app_store_policy_reviewed": true,
  "notes": "RU primary A2 demo model. Streaming CTC, single model.onnx + tokens.txt. Upstream: github.com/voicekit-team/T-one (Apache-2.0). Downloaded to device, NOT bundled in the APK. A2 demo evidence is not a launch-support claim; support matrix still requires WS6 benchmark evidence."
}
