{
  "schema_version": 1,
  "model_id": "m2m100-418m",
  "model_name": "Xenova/m2m100_418M (ONNX export of facebook/m2m100_418M)",
  "model_version": "Xenova-onnx-quantized-2024",
  "model_family": "dedicated-mt",
  "artifact_format": "onnx",
  "artifact_source_url": "https://huggingface.co/Xenova/m2m100_418M/resolve/main/onnx/decoder_model_quantized.onnx",
  "license_url": "https://opensource.org/license/mit",
  "sha256": "6015e31c8976659aedb06058c4dadf0f400d087a3f9830f838e68f220d79bcb6",
  "artifact_size_mb": 323.4691,
  "package_evidence_path": "package-evidence.json",
  "runtime_ids": ["onnxruntime-android"],
  "runtime_conversion_status": "converted_and_validated",
  "runtime_conversion_evidence_path": "runtime-conversion-evidence.json",
  "runtime_conversion_notes": "ONNX export of facebook/m2m100_418M from the Xenova/Transformers.js toolchain, SPLIT-decoder variant: encoder_model_quantized.onnx + decoder_model_quantized.onnx (prefill) + decoder_with_past_model_quantized.onnx (KV-cache steps). The merged decoder was rejected at runtime by native ONNX Runtime mobile (If/no-cache encoder cross-attn reshape on zero-length prefill), so the split pair is used. Consumed on Android via the official com.microsoft.onnxruntime:onnxruntime-android 1.22.0 OrtSession API (NOT the sherpa-onnx private runtime). Greedy autoregressive decode with forced-BOS target language token, validated on device SM-S937B (arm64-v8a) producing real translations in all four demo directions (RU->EN, EN->RU, RU->ZH, ZH->RU).",
  "legal_review_evidence_path": "legal-review-evidence.json",
  "intended_use": "mt",
  "distribution_mode": "first_run_download",
  "legal_review_status": "approved_for_distribution",
  "review_owner": "flex-translate",
  "review_date": "2026-06-01",
  "commercial_restrictions_reviewed": true,
  "privacy_impact_reviewed": true,
  "app_store_policy_reviewed": true,
  "notes": "WS4 flagship on-device MT model. ONE model serves all four demo directions (RU->EN, EN->RU, RU->ZH, ZH->RU) via a forced target-language token — no English pivot. Upstream facebook/m2m100_418M is MIT (commercial-OK); the Xenova ONNX export is the same MIT license. Weights are downloaded to the device (first_run_download), NOT bundled in the APK (~937 MB on-device footprint: 274.5 MB encoder + 323.5 MB prefill decoder + 299.1 MB with-past decoder + 7.6 MB tokenizer.json; the unused 328.2 MB merged decoder is not required). A2 demo evidence is NOT a launch-support claim; the support matrix still requires WS6 benchmark evidence. AVOIDED: NLLB / SeamlessM4T (CC-BY-NC, non-commercial — blocked)."
}
